<?xml version="1.0" encoding="UTF-8"?>
<!--
<articulo codigo="a-1345" xmlns:xsi="http://www.w3.org/2001/XMLSchema-instance" xsi:noNamespaceSchemaLocation="/home/dam1/Angel%20Ejercicios/lmxi_v2/TEMA%205/boletines/repasoEsquemas.xsd"></articulo>
-->
<!--
<empleado xmlns:xsi="http://www.w3.org/2001/XMLSchema-instance" xsi:noNamespaceSchemaLocation="/home/dam1/Angel%20Ejercicios/lmxi_v2/TEMA%205/boletines/repasoEsquemas.xsd"> 
  <nombre>Marta</nombre>
  <apellidos>
     <apellido1>Pérez</apellido1>
      <apellido2>Pérez</apellido2>
  </apellidos>
</empleado>
-->
<!--
<documento xmlns:xsi="http://www.w3.org/2001/XMLSchema-instance" xsi:noNamespaceSchemaLocation="/home/dam1/Angel%20Ejercicios/lmxi_v2/TEMA%205/boletines/repasoEsquemas.xsd">
 Estimado/a <nombre>Pablo Gómez</nombre>.
  Su petición realizada el día:<fecha>2015-03-16</fecha>
  será resuelta el día de hoy a las:<hora>12:10:00</hora>.
</documento>
-->
<!--
<encargados clase="A1" xmlns:xsi="http://www.w3.org/2001/XMLSchema-instance" xsi:noNamespaceSchemaLocation="/home/dam1/Angel%20Ejercicios/lmxi_v2/TEMA%205/boletines/repasoEsquemas.xsd">
  
  <encargado>
    <nombre>Manuel</nombre>
    <apellidos>Pérez</apellidos>
  </encargado>
  
  <encargado>
    <nombre>Marta</nombre>
    <apellidos>González</apellidos>
  </encargado>
  
</encargados>
-->
<encargados> 
    <encargado seccion=”s1”>
    <nombre>Marta</nombre>
    <apellidos>Sanchez</apellidos>
    <encargado>
 <encargado seccion=”s2”>
  <nombre>Mario</nombre>
  <apellidos>Casillas</apellidos>
<encargado>
</encargados>